{
  "schema_version": "1.0",
  "catalog_id": "shangyu_shipping_sop_v1",
  "source_documents": [
    {
      "title": "尚舆发货流程",
      "file_name": "尚舆发货流程.pdf",
      "document_date": "2026-09-20",
      "coverage_note": "已盘点第3、5、6、8、9、10、12、13、14页；规则状态由各来源规则包声明。"
    }
  ],
  "rules": {
    "GY-STORE-ASSIGNMENT": {
      "title": "按已确认商品、订单类型或显式来源证据选择管易店铺",
      "module": "guanyi.store_policy",
      "phase": "conversion",
      "source_refs": ["尚舆发货流程.pdf p.3", "p.8", "p.10", "p.12"],
      "allowed_implementation_refs": [
        "guanyi.store_assignment.fixed",
        "guanyi.store_assignment.by_product",
        "guanyi.store_assignment.by_source_channel",
        "guanyi.store_assignment.by_manual_route",
        "guanyi.store_assignment.by_manual_route_then_product"
      ]
    },
    "GY-PLATFORM-ORDER-NUMBER": {
      "title": "生成或复制管易平台单号",
      "module": "guanyi.platform_order_number",
      "phase": "conversion",
      "source_refs": ["尚舆发货流程.pdf p.3", "p.8", "p.10", "p.12"],
      "allowed_implementation_refs": [
        "guanyi.platform_order.preferred_order_identity",
        "guanyi.platform_order.prefix_daily_sequence",
        "guanyi.platform_order.prefix_minute_sequence",
        "guanyi.platform_order.affixed_preferred_order_identity"
      ]
    },
    "GY-BUYER-MEMBER": {
      "title": "填写买家会员",
      "module": "guanyi.buyer_member_policy",
      "phase": "conversion",
      "source_refs": ["尚舆发货流程.pdf p.8", "p.10"],
      "allowed_implementation_refs": [
        "guanyi.buyer_member.sam_pattern",
        "guanyi.buyer_member.policy"
      ]
    },
    "GY-PAYMENT-VALUES": {
      "title": "填写价格、支付金额与运费",
      "module": "guanyi.amount_policy",
      "phase": "conversion",
      "source_refs": ["尚舆发货流程.pdf p.8", "p.10"],
      "allowed_implementation_refs": ["guanyi.defaults.zero_amounts"]
    },
    "GY-WAREHOUSE-ASSIGNMENT": {
      "title": "选择管易仓库",
      "module": "guanyi.warehouse_policy",
      "phase": "conversion",
      "source_refs": ["尚舆发货流程.pdf p.3"],
      "allowed_implementation_refs": ["guanyi.defaults.warehouse_name"]
    },
    "GY-PAYMENT-METHOD": {
      "title": "选择支付方式",
      "module": "guanyi.payment_policy",
      "phase": "conversion",
      "source_refs": ["尚舆发货流程.pdf p.5"],
      "allowed_implementation_refs": ["guanyi.defaults.payment_method"]
    },
    "GY-ORDER-TYPE": {
      "title": "选择订单类型",
      "module": "guanyi.order_type_policy",
      "phase": "conversion",
      "source_refs": ["尚舆发货流程.pdf p.12"],
      "allowed_implementation_refs": ["guanyi.defaults.order_type"]
    },
    "GY-ORDER-FLAGS": {
      "title": "填写手机订单、货到付款和分销商标记",
      "module": "guanyi.order_flags_policy",
      "phase": "conversion",
      "source_refs": ["管易自定义订单导入说明"],
      "allowed_implementation_refs": ["guanyi.defaults.order_flags"]
    },
    "GY-PRODUCT-MAPPING": {
      "title": "将来源商品映射为管易商品和规格编码",
      "module": "guanyi.product_mapping",
      "phase": "conversion",
      "source_refs": ["尚舆发货流程.pdf p.4", "p.8", "p.10", "p.12"],
      "allowed_implementation_refs": ["guanyi.product_catalog.confirmed_exact"],
      "reason": "名称相似只能形成候选；商品或规格映射未确认时必须阻断。"
    },
    "GY-ITEM-EXPANSION": {
      "title": "将来源组合商品展开为多个管易商品行",
      "module": "guanyi.item_expansion",
      "phase": "conversion",
      "source_refs": ["SAM原始订单与人工管易成品对照", "用户确认：2026-10-02"],
      "allowed_implementation_refs": [
        "guanyi.item_expansion.confirmed_source_components"
      ],
      "reason": "组合商品不得伪装成同一来源编码的多条普通映射；必须按已确认组成和数量倍数展开。"
    },
    "GY-RECIPIENT-COMPLETENESS": {
      "title": "校验收件人、联系方式和完整地址",
      "module": "guanyi.recipient_validation",
      "phase": "conversion",
      "source_refs": ["尚舆发货流程.pdf p.5", "p.8", "p.10"],
      "allowed_implementation_refs": ["source.recipient.required_fields"]
    },
    "GY-JD-ZTO-CONTACT-SUFFIX": {
      "title": "自营京东中通订单把姓名后的四位码追加到联系方式",
      "module": "guanyi.contact_suffix_policy",
      "phase": "conversion",
      "source_refs": ["SRC-SAMPLE-TEXT-ORDER-001", "DEC-USER-JD-ZTO-CONTACT-SUFFIX-001"],
      "allowed_implementation_refs": [
        "guanyi.contact_suffix.jd_zhongtong_recipient_marker"
      ],
      "reason": "京东中通订单需要以号码-四位码形式传递平台隐私号后缀；四位码缺失或姓名、地址、已有号码尾码冲突时必须阻断并追问。"
    },
    "GY-LOGISTICS-SELECTION": {
      "title": "按商品与数量选择韵达或中通重货",
      "module": "guanyi.logistics_policy",
      "phase": "conversion",
      "source_refs": ["尚舆发货流程.pdf p.3", "p.10"],
      "allowed_implementation_refs": [
        "guanyi.logistics.corn_packaging_policy",
        "guanyi.logistics.default_yunda"
      ],
      "planned_implementation_refs": ["guanyi.logistics.weight_threshold"],
      "question": "如果以后用重量公式替换当前包装规则，请提供重量阈值和适用商品重量。",
      "reason": "当前版本已确认按包装数量执行；未来重量公式作为可替换策略实现。",
      "answer_type": "single_choice",
      "choices": [
        "按8根装数量≥2或10根礼盒装走中通，其余韵达",
        "按整单重量判断，我将提供重量阈值",
        "来源文件必须提供物流公司，系统不自动判断"
      ]
    },
    "GY-SELLER-REMARK-POLICY": {
      "title": "生成管易卖家备注",
      "module": "guanyi.seller_remark_policy",
      "phase": "conversion",
      "source_refs": ["尚舆发货流程.pdf p.3"],
      "allowed_implementation_refs": [
        "guanyi.seller_remark.rule_composition"
      ],
      "question": "后续新增系统提示时，按已确认的卖家备注组合策略接入。",
      "reason": "客户备注写入卖家备注已经确认；系统提示按固定顺序追加并精确去重。"
    },
    "GY-DELIVERY-INSTRUCTION-ADDRESS": {
      "title": "把快递员配送指令追加到收货地址末尾",
      "module": "guanyi.note_routing_policy",
      "phase": "conversion",
      "source_refs": ["用户确认：2026-10-09", "codex-clipboard-0e8d0696-b4b1-41fd-868a-56d28e506fe3.jpg"],
      "allowed_implementation_refs": [
        "guanyi.note_routing.courier_instruction_to_address"
      ],
      "reason": "送货上门、不准放门口等给快递员的指令必须随收货地址传递；非快递员备注继续进入卖家备注。"
    },
    "GY-DAILY-GOODS-WHITE-LABEL": {
      "title": "精确白标SKU命中后整单添加白标商品备注",
      "module": "guanyi.seller_remark_policy",
      "phase": "conversion",
      "source_refs": [
        "DEC-USER-WHITELABEL-LIB-001",
        "config/catalog/white_label_skus_v1.json"
      ],
      "allowed_implementation_refs": ["guanyi.seller_remark.white_label_sku_library"],
      "reason": "商品完成管易代码和规格代码映射后精确匹配版本化白标库；任一商品命中则整单卖家备注追加白标商品。"
    },
    "GY-IMPORT-STATUS-PENDING-REVIEW": {
      "title": "导入订单状态选择待审核",
      "module": "guanyi.browser.import_form",
      "phase": "upload",
      "source_refs": ["尚舆发货流程.pdf p.9"],
      "allowed_implementation_refs": ["browser.guanyi.prepare_import_form.pending_review"]
    },
    "GY-IMPORT-OPTIONS": {
      "title": "确认自定义导入页面的附加勾选项",
      "module": "guanyi.browser.import_form",
      "phase": "upload",
      "source_refs": ["尚舆发货流程.pdf p.9"],
      "allowed_implementation_refs": ["browser.guanyi.import_options.verified_current_ui"]
    },
    "GY-UPLOAD-SUBMISSION": {
      "title": "点击确定并提交自定义订单导入",
      "module": "guanyi.browser.upload_submit",
      "phase": "upload",
      "source_refs": ["尚舆发货流程.pdf p.9"],
      "allowed_implementation_refs": ["browser.guanyi.submit_import.guarded"]
    },
    "GY-TASK-RECONCILIATION": {
      "title": "用任务中心唯一新增任务核验导入结果",
      "module": "guanyi.browser.task_reconciliation",
      "phase": "post_upload",
      "source_refs": ["尚舆发货流程.pdf p.9", "自动化安全增强规则"],
      "allowed_implementation_refs": ["browser.guanyi.task_reconciliation.unique_verified_id"]
    },
    "GY-ORDER-AUDIT": {
      "title": "导入后审核管易订单",
      "module": "guanyi.browser.order_audit",
      "phase": "post_upload",
      "source_refs": ["尚舆发货流程.pdf p.7", "p.9"],
      "allowed_implementation_refs": ["browser.guanyi.order_audit.guarded"]
    },
    "BLH-SHIPPING-BACKFILL": {
      "title": "管易产生物流后回填百礼汇包裹",
      "module": "bailihui.post_fulfillment",
      "phase": "post_fulfillment",
      "source_refs": ["尚舆发货流程.pdf p.13", "p.14"],
      "allowed_implementation_refs": [],
      "planned_implementation_refs": ["bailihui.shipping_backfill.guarded"]
    },
    "GY-MANUAL-ADDRESS-RECOGNITION": {
      "title": "手工新增订单时使用地址智能识别",
      "module": "guanyi.manual_entry",
      "phase": "manual_entry",
      "source_refs": ["尚舆发货流程.pdf p.5"],
      "allowed_implementation_refs": [],
      "planned_implementation_refs": ["guanyi.manual_entry.smart_address"]
    },
    "GY-MANUAL-AUTO-CONCESSION": {
      "title": "手工新增订单时执行自动让利",
      "module": "guanyi.manual_entry",
      "phase": "manual_entry",
      "source_refs": ["尚舆发货流程.pdf p.6"],
      "allowed_implementation_refs": [],
      "planned_implementation_refs": ["guanyi.manual_entry.auto_concession"]
    }
  },
  "scopes": {
    "tiantian_to_guanyi_v1": {
      "route_id": "tiantian_warehouse_to_guanyi_v2",
      "required_rules": {
        "conversion": [
          "GY-STORE-ASSIGNMENT",
          "GY-PLATFORM-ORDER-NUMBER",
          "GY-BUYER-MEMBER",
          "GY-PAYMENT-VALUES",
          "GY-WAREHOUSE-ASSIGNMENT",
          "GY-PAYMENT-METHOD",
          "GY-ORDER-TYPE",
          "GY-ORDER-FLAGS",
          "GY-PRODUCT-MAPPING",
          "GY-RECIPIENT-COMPLETENESS",
          "GY-LOGISTICS-SELECTION",
          "GY-SELLER-REMARK-POLICY",
          "GY-DAILY-GOODS-WHITE-LABEL",
          "GY-DELIVERY-INSTRUCTION-ADDRESS"
        ],
        "upload": [
          "GY-IMPORT-STATUS-PENDING-REVIEW",
          "GY-IMPORT-OPTIONS",
          "GY-UPLOAD-SUBMISSION"
        ],
        "post_upload": [
          "GY-TASK-RECONCILIATION",
          "GY-ORDER-AUDIT"
        ]
      }
    },
    "sam_to_guanyi_v1": {
      "route_id": "sam_to_guanyi_v1",
      "required_rules": {
        "conversion": [
          "GY-STORE-ASSIGNMENT",
          "GY-PLATFORM-ORDER-NUMBER",
          "GY-BUYER-MEMBER",
          "GY-PAYMENT-VALUES",
          "GY-WAREHOUSE-ASSIGNMENT",
          "GY-PAYMENT-METHOD",
          "GY-ORDER-TYPE",
          "GY-ORDER-FLAGS",
          "GY-PRODUCT-MAPPING",
          "GY-ITEM-EXPANSION",
          "GY-RECIPIENT-COMPLETENESS",
          "GY-LOGISTICS-SELECTION",
          "GY-SELLER-REMARK-POLICY",
          "GY-DAILY-GOODS-WHITE-LABEL",